{
  "ladder_id": "jacobs-ladder-of-assets-v1",
  "description": "Jacob's Ladder of Assets: a total, ordered asset-class ontology grounding the estate omnirisk `asset_class` axis in the real economy, from tangible extraction (0) to pure digital services (8). Replaces the thin {credit,equity,market,crypto} enum and supplies EP's value-genesis (extraction + labor-mixing are where Revenue originates before it is a financial claim). Each rung binds a valuation_model and an RM-1 risk_F_family.",
  "replaces_enum": ["credit", "equity", "market", "crypto"],
  "rungs": [
    {
      "value_stage": 0,
      "rung_label": "0",
      "key": "natural_capital",
      "label": "Natural capital (land / deposits / ecosystems / biological stock)",
      "tangibility": "tangible",
      "rivalry": "rival",
      "renewability": "depleting_stock",
      "process_regime": "monotone_absorbing",
      "labor_content": "none",
      "valuation_model": "real_option",
      "risk_F_family": "expected_shortfall",
      "risk_F_note": "coherent tail (ES) over the joint reserve x commodity-price distribution of the in-situ stock",
      "genesis_note": "Value = scarcity x location x option-to-extract (a real option on the underlying reserve). The base of the ladder: nature before any labor is mixed in."
    },
    {
      "value_stage": 1,
      "rung_label": "1",
      "key": "extractive_nonrenewable",
      "label": "Extractive non-renewable (mining / drilling)",
      "tangibility": "tangible",
      "rivalry": "rival",
      "renewability": "depleting_stock",
      "process_regime": "monotone_absorbing",
      "labor_content": "moderate",
      "valuation_model": "hotelling_rent",
      "risk_F_family": "expected_shortfall",
      "risk_F_note": "commodity-price tail plus a monotone depletion path toward the absorbing barrier at zero reserves",
      "genesis_note": "Hotelling rule: in-situ price (scarcity rent) grows at the interest rate r; the optimal-depletion program empties a DEPLETING stock. Extraction is a first site of Revenue genesis."
    },
    {
      "value_stage": 2,
      "rung_label": "1'",
      "key": "renewable_harvest",
      "label": "Renewable harvest (farming / forestry / fishing / animal husbandry)",
      "tangibility": "tangible",
      "rivalry": "rival",
      "renewability": "regenerating_flow",
      "process_regime": "mean_reverting_ou",
      "labor_content": "high",
      "valuation_model": "sustainable_yield",
      "risk_F_family": "sortino",
      "risk_F_note": "downside deviation of realized yield below the maximum-sustainable-yield target under weather / biological shocks",
      "genesis_note": "Sustainable-yield: value from a REGENERATING flow harvested at or below its renewal rate. Mean-reverting (OU-like) stock dynamics; weather / biological risk. Overharvesting collapses the flow."
    },
    {
      "value_stage": 3,
      "rung_label": "2",
      "key": "processed_goods",
      "label": "Processed goods (refining / manufacturing / craft)",
      "tangibility": "tangible",
      "rivalry": "rival",
      "renewability": "regenerating_flow",
      "process_regime": "mean_reverting_ou",
      "labor_content": "high",
      "valuation_model": "labor_value_add",
      "risk_F_family": "expected_shortfall",
      "risk_F_note": "coherent tail over the processing-margin distribution (input cost, throughput, spoilage)",
      "genesis_note": "Lockean value-add = labor + capital + know-how mixed into extracted / harvested inputs. A reproducible flow whose price mean-reverts toward marginal cost. The peak of physical value-genesis."
    },
    {
      "value_stage": 4,
      "rung_label": "3",
      "key": "commodity_market",
      "label": "Commodity market (grains / metals / energy)",
      "tangibility": "semi_tangible",
      "rivalry": "rival",
      "renewability": "non_physical",
      "process_regime": "non_physical",
      "labor_content": "low",
      "valuation_model": "spot_futures_vol",
      "risk_F_family": "spectral",
      "risk_F_note": "spectral (coherent) risk over the loss distribution implied by the vol surface; consumes the FTP/market vol-surface engine (#44)",
      "genesis_note": "Spot + futures + vol surface: the claim layer over physical commodities. References the merged economic-prophet market/vol-surface work (#44)."
    },
    {
      "value_stage": 5,
      "rung_label": "4",
      "key": "labor_market",
      "label": "Labor market (human capital / wages)",
      "tangibility": "semi_tangible",
      "rivalry": "rival",
      "renewability": "non_physical",
      "process_regime": "non_physical",
      "labor_content": "high",
      "valuation_model": "human_capital_wage",
      "risk_F_family": "sortino",
      "risk_F_note": "downside deviation of realized wage / human-capital return below its productivity anchor",
      "genesis_note": "Human capital priced as a wage / productivity claim. References the Labor Network Charter (prophet-workspace #109). A person's labor-hours are RIVAL."
    },
    {
      "value_stage": 6,
      "rung_label": "5",
      "key": "mercantile_trade",
      "label": "Mercantile trade (merchants / logistics / arbitrage)",
      "tangibility": "semi_tangible",
      "rivalry": "rival",
      "renewability": "non_physical",
      "process_regime": "non_physical",
      "labor_content": "moderate",
      "valuation_model": "spatiotemporal_arbitrage",
      "risk_F_family": "expected_shortfall",
      "risk_F_note": "coherent tail over inventory / transit / basis risk while goods are in motion",
      "genesis_note": "Value from moving goods across space and time (arbitrage of price differences). No transformation of the good itself -- only of its position."
    },
    {
      "value_stage": 7,
      "rung_label": "6",
      "key": "pure_service",
      "label": "Pure service (contract cash-flow)",
      "tangibility": "intangible",
      "rivalry": "rival",
      "renewability": "non_physical",
      "process_regime": "non_physical",
      "labor_content": "high",
      "valuation_model": "dcf",
      "risk_F_family": "expected_shortfall",
      "risk_F_note": "coherent tail over the contracted cash-flow / credit-loss distribution",
      "genesis_note": "Contract / cash-flow DCF -- the traditional EP object. A rival service (delivered capacity is consumed) valued by discounting its cash flows."
    },
    {
      "value_stage": 8,
      "rung_label": "7",
      "key": "digital_asset",
      "label": "Digital asset (tokens / data / software / IP)",
      "tangibility": "intangible",
      "rivalry": "non_rival",
      "renewability": "non_physical",
      "process_regime": "non_physical",
      "labor_content": "low",
      "valuation_model": "network_memetic",
      "risk_F_family": "expected_shortfall",
      "risk_F_note": "coherent tail (ES) over a REFLEXIVE, fat-tailed return distribution F; consumes the crypto asset-class contract in flight (CAV-1)",
      "genesis_note": "NON-RIVAL. Value is network / memetic (Metcalfe, NVT), not scarcity: copying is free, so a scarcity/DCF price is the WRONG model. References the crypto asset-class contract in flight."
    },
    {
      "value_stage": 9,
      "rung_label": "8",
      "key": "digital_service",
      "label": "Digital service (SaaS / agentic / information)",
      "tangibility": "intangible",
      "rivalry": "non_rival",
      "renewability": "non_physical",
      "process_regime": "non_physical",
      "labor_content": "moderate",
      "valuation_model": "economia_mentium",
      "risk_F_family": "spectral",
      "risk_F_note": "spectral (coherent) risk over the epistemic-delta distribution of the information service",
      "genesis_note": "Economia Mentium: value = epistemic delta (knowledge added), liquidity = attention. NON-RIVAL and unbounded by physical stock. The top of the ladder."
    }
  ]
}
